{
  "$schema": "https://json-schema.org/draft/2020-12/schema",
  "$id": "https://wayjournal.dev/schemas/wayjournal.verified-proof.v1.json",
  "title": "wayjournal.verified-proof/v1",
  "$defs": {
    "logicalStoreId": {
      "type": "object",
      "additionalProperties": false,
      "required": ["genesis_fingerprint", "store_uuid"],
      "properties": {
        "genesis_fingerprint": {"type": "string", "pattern": "^[0-9a-f]{64}$"},
        "store_uuid": {"type": "string", "format": "uuid", "pattern": "^[0-9a-f]{8}-[0-9a-f]{4}-7[0-9a-f]{3}-[89ab][0-9a-f]{3}-[0-9a-f]{12}$"}
      }
    },
    "qualifiedEntityRef": {
      "type": "object",
      "additionalProperties": false,
      "required": ["domain", "entity_id", "store"],
      "properties": {
        "domain": {"type": "string", "maxLength": 128, "pattern": "^[a-z][a-z0-9_-]{0,62}(\\.[a-z][a-z0-9_-]{0,62})+$"},
        "entity_id": {"type": "string", "format": "uuid", "pattern": "^[0-9a-f]{8}-[0-9a-f]{4}-[1345678][0-9a-f]{3}-[89ab][0-9a-f]{3}-[0-9a-f]{12}$"},
        "store": {"$ref": "#/$defs/logicalStoreId"}
      }
    },
    "storeRevision": {
      "type": "object",
      "additionalProperties": false,
      "required": ["algorithm", "digest"],
      "properties": {
        "algorithm": {"const": "wayjournal.store/blake3-framed-v1"},
        "digest": {"type": "string", "pattern": "^[0-9a-f]{64}$"}
      }
    }
  },
  "type": "object",
  "additionalProperties": false,
  "required": ["local_trust_binding", "observed_at", "proof_id", "record_id", "schema", "source_revision", "subject"],
  "properties": {
    "local_trust_binding": {"type": "string", "pattern": "^[0-9a-f]{64}$"},
    "observed_at": {"type": "string", "format": "date-time", "maxLength": 33, "pattern": "^(?:[0-9]{4}|[+-][0-9]{6})-[0-9]{2}-[0-9]{2}T[0-9]{2}:[0-9]{2}:[0-9]{2}(?:\\.[0-9]{0,8}[1-9])?Z$"},
    "proof_id": {"type": "string", "pattern": "^[0-9a-f]{64}$"},
    "record_id": {"type": "string", "format": "uuid", "pattern": "^[0-9a-f]{8}-[0-9a-f]{4}-7[0-9a-f]{3}-[89ab][0-9a-f]{3}-[0-9a-f]{12}$"},
    "schema": {"const": "wayjournal.verified-proof/v1"},
    "source_revision": {"$ref": "#/$defs/storeRevision"},
    "subject": {"$ref": "#/$defs/qualifiedEntityRef"}
  },
  "x-wayjournal-maxBytes": 8388608,
  "x-wayjournal-proofId": "BLAKE3 over the frozen ten-field length-framed preimage; enforced by the runtime codec"
}
